{
  "application": {
    "name": "workflow-engine",
    "type": "automation",
    "version": "1.0.0",
    "compliance_level": ["hipaa", "gdpr"]
  },
  "infrastructure": {
    "target": "lambda",
    "scaling": {
      "min_instances": 1,
      "max_instances": 5,
      "target_cpu": 0
    },
    "resources": {
      "cpu": "256",
      "memory": "512",
      "gpu": null
    }
  },
  "security": {
    "encryption_at_rest": true,
    "encryption_in_transit": true,
    "authentication": "api_key",
    "authorization": "rbac",
    "secrets_management": "aws_secrets"
  },
  "monitoring": {
    "health_checks": {},
    "metrics": [],
    "logging": {},
    "alerting": {}
  },
  "environment": {},
  "dependencies": []
}
